<xs:schema attributeFormDefault="unqualified" elementFormDefault="qualified" xmlns:xs="http://www.w3.org/2001/XMLSchema">
  <xs:element name="liste">
    <xs:complexType>
      <xs:sequence>
        <xs:element name="étudiant" maxOccurs="unbounded" minOccurs="0">
          <xs:complexType>
            <xs:sequence>
              <xs:element type="xs:string" name="nom"/>
              <xs:element type="xs:string" name="prénom"/>
              <xs:element type="xs:byte" name="age"/>
              <xs:element name="tél" maxOccurs="unbounded" minOccurs="0">
                <xs:complexType>
                  <xs:simpleContent>
                    <xs:extension base="xs:int">
                      <xs:attribute type="xs:string" name="type" use="optional"/>
                    </xs:extension>
                  </xs:simpleContent>
                </xs:complexType>
              </xs:element>
              <xs:element type="xs:string" name="email"/>
              <xs:element name="photo">
                <xs:complexType>
                  <xs:simpleContent>
                    <xs:extension base="xs:string">
                      <xs:attribute type="xs:string" name="source" use="optional"/>
                      <xs:attribute type="xs:byte" name="hauteur" use="optional"/>
                      <xs:attribute type="xs:byte" name="largeur" use="optional"/>
                    </xs:extension>
                  </xs:simpleContent>
                </xs:complexType>
              </xs:element>
              <xs:element type="xs:string" name="description" minOccurs="0"/>
              <xs:element name="CV" minOccurs="0">
                <xs:complexType>
                  <xs:simpleContent>
                    <xs:extension base="xs:string">
                      <xs:attribute type="xs:string" name="file"/>
                    </xs:extension>
                  </xs:simpleContent>
                </xs:complexType>
              </xs:element>
            </xs:sequence>
            <xs:attribute type="xs:string" name="code" use="optional"/>
          </xs:complexType>
        </xs:element>
      </xs:sequence>
      <xs:attribute type="xs:short" name="année"/>
    </xs:complexType>
  </xs:element>
</xs:schema>